ID,nickname,gender,location,birthday,description,verified_reason,talent,education,work,weibo_num,following,followers
1282005885,蔡康永,男,台湾 台北市,,**工作聯絡,台湾知名节目主持人,,,電影電視製作專業碩士MFA ,1083,1973,37309701
5644764907,火箭少女101_杨超越,女,上海 黄浦区,1998-07-31,,火箭少女101成员,,,,766,214,13150913
1640571365,罗永浩,男,北京 东城区,0001-00-00,Smartisan，智能机时代的工匠,锤子科技 CEO,,,,34319,2912,16667826
1566301073,贾玲,女,北京 朝阳区,0001-00-00,仅限工作联系：zhangwen@dawanyule.com 微博：@张闻儿,女喜剧演员,,,,2417,684,13072134
5888671022,王嘉尔,男,海外,1994-03-28,终于来了! 您好! 我是 王嘉尔 您可以叫我 嘉嘉 Jackson 或者 +2. JYP ! GOT7 的中国成员 Never give up on things you can't live a day without.,歌手、主持人,,,,656,116,235823831282005885,蔡康永,男,台湾 台北市,,**工作聯絡,台湾知名节目主持人,,,電影電視製作專業碩士MFA ,1083,1973,37309690
